id,Title,Image,Category
1113140,iridescent sparkle confetti 10 oz 282 grams of cellophane rainbow foil glitter mylar unicorn flakes for crafts resin epoxy glass snow globes invitations new years surprise birthday party,https://m.media-amazon.com/images/I/81jliFKwo6L.jpg,party decorations
1113852,dragon party hanging swirls dragon knight ceiling swirls fantasy dragon foil swirls dragon birthday party decorations streamers for dragon theme baby shower supplies,https://m.media-amazon.com/images/I/917lXptkC7L.jpg,party decorations
1114657,pink white rosegold small balloons 5 inch 60pcs round latex balloon gender reveal birthday graduation wedding engagement baby bridal shower party decorations lasting surprise,https://m.media-amazon.com/images/I/41O20-Ml8qS.jpg,party decorations
577786,halloween rose skull candle party centerpieces stand glowing candle table decorations wedding bridal shower baby shower birthday cosplay party supplies,https://m.media-amazon.com/images/I/81OWTYL2+2L.jpg,party decorations
575910,black and gold party balloons 50pcs black gold silver confetti latex balloons for birthday wedding baby showe gender graduation anniversary retirement party decoration,https://m.media-amazon.com/images/I/71rb4e9+HFL.jpg,party decorations
576526,video game hanging swirls 21 pcs video game party decorations for kids boys gamer birthday party ceiling window door decors hanging whirls streamers for gaming night party supplies,https://m.media-amazon.com/images/I/71UQSnxNA9L.jpg,party decorations
574964,60 pcs balloon clips s for balloon archballoon column stand and balloon flowers birthday wedding baby shower party decorations,https://m.media-amazon.com/images/I/71IMqULYBuL.jpg,party decorations
1119101,bigjigs rail the sleeper train other major wooden rail brands are compatible,https://m.media-amazon.com/images/I/51Z6ETjkDRL.jpg,toy vehicle playsets
1118643,woodland scenics cinders ballast 32 oz shaker,https://m.media-amazon.com/images/I/51BJAEsdsWL.jpg,toy vehicle playsets
1117444,power treads nitro stunt pack allsurface toy vehicles 30 pieces multicolor,https://m.media-amazon.com/images/I/71iJ3mkwb2L.jpg,toy vehicle playsets
1118236,replacement part for thomas and friends wooden lift and load cargo train set ggh31 replacement train engine charlie purple,https://m.media-amazon.com/images/I/51UnL0bC3AL.jpg,toy vehicle playsets
1119187,woodland scenics br5050 j franks grocery ho,https://m.media-amazon.com/images/I/61KBVG5uh9L.jpg,toy vehicle playsets
1117871,woodland scenics a2174 painters n woou2174,https://m.media-amazon.com/images/I/51utULLwl7L.jpg,toy vehicle playsets
1118344,the original toy company wood toy train playset circus train,https://m.media-amazon.com/images/I/61B43qyZlQL.jpg,toy vehicle playsets
1037888,ever ready first aid cpr face shield fits adults children and infants 20 pack,https://m.media-amazon.com/images/I/71G-kjn7i4L.jpg,occupational health safety products
1417095,richardjov 12pcs glove clip holder safety work gloves clip for belt metal glove keeper loop glove grabber clip holderyellow,https://m.media-amazon.com/images/I/7163wpMpJ0L.jpg,occupational health safety products
1035504,oudain 6 pack adjustable kid eyeglass strap eyeglass band sports glasses strap multi color,https://m.media-amazon.com/images/I/717Clsc0ikL.jpg,occupational health safety products
1037443,3 pack us mail delivery driver magnetic signs 128 rural delivery carrier magnets delivery driver accessories,https://m.media-amazon.com/images/I/71meuyCmZzL.jpg,occupational health safety products
1417462,tradesafe lockout bag for lockout tagout devices lock out bag for loto supplies wearresistant polyester canvas material easy to carry tool kit bag with handles 938 x 512 x 4516 inches,https://m.media-amazon.com/images/I/814aOFyyztL.jpg,occupational health safety products
1036240,2 pack tennis wrist supportwrist bands for working outadjustable carpal tunnel wrist bracelightweight wrist wrapssweat wristband support for mensuitable for various fitness sports occasions,https://m.media-amazon.com/images/I/81IeTqyeH2L.jpg,occupational health safety products
1417452,plugfones prpsy10 prp sy10 comfortiered silicone replacement earplugs 10pkg 5 pa yellow,https://m.media-amazon.com/images/I/41myYqYeFlL.jpg,occupational health safety products
1284085,halloween witch hat for women steeple lace halloween costume accessory for party,https://m.media-amazon.com/images/I/61bbkbgkm+L.jpg,kids party supplies
1283359,black and red gold balloon garland kit 135pcs latex chrome gold and crown star balloons for birthday party anniversary 2023 graduation prom day decorations,https://m.media-amazon.com/images/I/81C38bHNiaL.jpg,kids party supplies
1285501,novelty place 12pcs inflatable guitar for kids 35in blow up electric guitars assorted colors waterproof inflatable rock star guitar toy for 80s 90s musical concert themed party favor,https://m.media-amazon.com/images/I/91JXX+KT03L.jpg,kids party supplies
303894,soccer party decorations soccer birthday party backdrop banner soccer theme birthday party decorations photo booth props background for soccer birthday decorations 708 45in,https://m.media-amazon.com/images/I/91-ZVZbENKL.jpg,kids party supplies
1284501,12 pack 6oz light up cupled light up toys glow in the dark party favor supplies for kids new years eve party supplies party toy thanksgiving holiday birthday gift party pack replaceable battery,https://m.media-amazon.com/images/I/71XN2APCRUL.jpg,kids party supplies
1284451,18 pcs fiesta party balloons supplies taco balloons mexican balloons cinco de mayo party decorations cactus avocado hat jumbo mylar foil balloons fiesta party decorations,https://m.media-amazon.com/images/I/81pJzTSi-zL.jpg,kids party supplies
304156,capoda 60 pcs pirate party decorations include 30 pcs pirate rubber bracelets and 30 pcs pirate button pins badges for kids birthday adventure carnival pirate nautical theme party favors supplies,https://m.media-amazon.com/images/I/81cQPXZJHQL.jpg,kids party supplies
220509,convertible travel garment bagcarry on garment duffel bag for men women 2 in 1 hanging suitcase suit business travel bag black,https://m.media-amazon.com/images/I/719-y08DliL.jpg,luggage
221699,initial canvas beach tote bag with zipper pockets strap personalized birthday gifts wedding gifts for women mom her,https://m.media-amazon.com/images/I/71rsalVQQ6L.jpg,luggage
219799,original x large waterproof washable tip proof durable open tote bag for the beach boat pool sports 19x15x95,https://m.media-amazon.com/images/I/71d46tdc9ZL.jpg,luggage
222430,vintage star wars large reusable tote bag,https://m.media-amazon.com/images/I/81owZ0cZL3S.jpg,luggage
220763,silverwood ii hardside expandable spinner luggage navyout of stock 21 carryon,https://m.media-amazon.com/images/I/71-S0AfIjzL.jpg,luggage
220093,rolling garment bag with wheels away luggage for suits with wheels wheeled garment bag for travel 2 in 1 rolling duffel bag black,https://m.media-amazon.com/images/I/813A6zpRFvL.jpg,luggage
222788,large straw beach bags for women large tote bag summer travel,https://m.media-amazon.com/images/I/517SPnLVPKL.jpg,luggage
240,3 pieces clear pvc suitcase protector waterproof cover for luggage tsa approved luggage 24 inches 28 inches 30 inches black border,https://m.media-amazon.com/images/I/61WbaqbTsWL.jpg,suitcases
40,chasm sport duffel bag,https://m.media-amazon.com/images/I/61zeJnscnTL.jpg,suitcases
868,suitcases blue navy blue upright s length 40 cm 55 cm41 l,https://m.media-amazon.com/images/I/71rEa1lcanL.jpg,suitcases
364,epic softside medium checkin,https://m.media-amazon.com/images/I/81V65gQe88L.jpg,suitcases
626,single row mute universal wheel pair of drawbar box luggage suitcase baggage case wheel replacement,https://m.media-amazon.com/images/I/51mvcMqteDL.jpg,suitcases
312,core aluminum hardside luggage with double spinner wheels quiet tsa lock suitcase 26inch silver,https://m.media-amazon.com/images/I/61QIQy1v8bL.jpg,suitcases
324,carry on luggage hard shell travel trolley 4 spinner wheels lightweight polypropylene suitcase with tsa lock carryon 21inch orange,https://m.media-amazon.com/images/I/51Gy5d3EdoL.jpg,suitcases
733705,sleeping dogs playstation 3,https://m.media-amazon.com/images/I/91oSNUBZPiL.jpg,playstation 3 games consoles accessories
735246,multi out av cable highdefinition component videoaudio cable for the playstation ps2 ps3 gaming system hdtv or edtv connector with colorcoded connectors,https://m.media-amazon.com/images/I/515z4viQGbL.jpg,playstation 3 games consoles accessories
733637,replacement internal hard disk drive hdd caddy mounting bracket base tray support holder with screws for playstation 3 ps3 fat,https://m.media-amazon.com/images/I/51aZiMikgfL.jpg,playstation 3 games consoles accessories
732815,grand theft auto v ps3,https://m.media-amazon.com/images/I/81X9aPJMidL.jpg,playstation 3 games consoles accessories
735254,eye pet and friends playstation 3,https://m.media-amazon.com/images/I/81yaS5pL87L.jpg,playstation 3 games consoles accessories
733060,skylanders swap force character wash buckler includes trading card and internet code no retail packaging,https://m.media-amazon.com/images/I/51luRZabwXL.jpg,playstation 3 games consoles accessories
733921,fifa street essentials game ps3,https://m.media-amazon.com/images/I/71XA5yynydS.jpg,playstation 3 games consoles accessories
563875,sigvan 6 pack oprah style reading glasses blue light blocking square computer spring hinge readers for women,https://m.media-amazon.com/images/I/81a280wuuIL.jpg,vision products
563647,8 set nose sun protection nose protector uv nose patch for glasses sunlight men women sports 3 colors,https://m.media-amazon.com/images/I/81NVGQiM0GL.jpg,vision products
564188,gel lens cleaner kit 2 2oz eye glasses cleaner gel spray 2 microfiber cleaning cloths safe for ar coated all lenses screens electronics 4oz blue,https://m.media-amazon.com/images/I/81vI7vEhUeL.jpg,vision products
563328,4 pack computer reading glasses blue light blocking anti eyestrain spring hinge stylish readers for women 200 strength,https://m.media-amazon.com/images/I/71bDftXwKDL.jpg,vision products
563051,2 pairs unisex super lightweight rimless quality readers ultra thin clear lenses frameless reading glasses 25,https://m.media-amazon.com/images/I/513IYLm3r7L.jpg,vision products
564341,5 pcs eye glasses lens cleaner tool mini sun glasses eyeglass microfiber spectacles cleaner soft brush cleaning clip kitcolor random,https://m.media-amazon.com/images/I/51sv+i4kH1L.jpg,vision products
562275,blue light blocking glasses computer readinggamingtvphones glasses for men womenanti eyestrain uv glare,https://m.media-amazon.com/images/I/513V0pFEy3L.jpg,vision products
472402,30 positions floss organizer embroidery shelf thread organizers for cross embroidery thread holder with 4pcs replaceable paper card needle holder green,https://m.media-amazon.com/images/I/61tPr0+V4aL.jpg,needlework supplies
472935,dimensions counted cross stitch animal christmas sweater ornament craft kit 3 pc,https://m.media-amazon.com/images/I/918fH5S9ybL.jpg,needlework supplies
472711,dimensions gold collection flower vase advanced cross stitch kit 11 x 15 14 count navy aida 5 piece,https://m.media-amazon.com/images/I/815Yu0mmVXL.jpg,needlework supplies
879030,stitchups frankenstein needlepoint ornament kit,https://m.media-amazon.com/images/I/516Frd+5UiL.jpg,needlework supplies
878908,stitch zip needlepoint cosmetic purse kit geometric arrows,https://m.media-amazon.com/images/I/81YURCr6OsL.jpg,needlework supplies
474386,cross stitch kits stamped own4b coffee cup printed pattern 11ct 134x87 inch diy embroidery kit coffee cup,https://m.media-amazon.com/images/I/81wQZnfi-JL.jpg,needlework supplies
876876,janlynn stamped cross stitch kit just ducky bib 912 x 11,https://m.media-amazon.com/images/I/91zxV+ATXHL.jpg,needlework supplies
347312,topincn small pet tent guinea pig hideout hamster hammock hanging bed corner cloth tassels curtain hideaway for small animaldotblack,https://m.media-amazon.com/images/I/614kKNH3KhL.jpg,pet bird supplies
346494,antiscratch shoulder protector cape training shoulder cape thicken cloth bird training cape pet shoulder pad diaper shawl shoulder protector for birdsrandom color bell pendant,https://m.media-amazon.com/images/I/714jH2Tap1L.jpg,pet bird supplies
344185,2pcs pigeon feeder bird dispenser slot container poultry plastic thick trough dish less waste with removable steel wire partition for pigeons quails birds chicks ducklings,https://m.media-amazon.com/images/I/71m+G-aNpLL.jpg,pet bird supplies
343548,large size parrot nest house winter warm bird snuggle hut hanging birds house cage hideaway cave bed for large birds amazon parrots african grey cockatoos macaws,https://m.media-amazon.com/images/I/715lAcZmsTS.jpg,pet bird supplies
345473,2pcs multifunctional hanging bird feeder boxlarge plastic food bowlleed water feeders dispenser pet cage accessories with hanging hookseasily mounts to any cage,https://m.media-amazon.com/images/I/41jBtGAYpDL.jpg,pet bird supplies
347574,bird cage feeder splash proof acrylic pet parrots seeds feeder no mess automatic food feeder with perch for budgerigar cockatiel parakeet finchl single type feeders,https://m.media-amazon.com/images/I/51e5MCtsUKL.jpg,pet bird supplies
347238,hanging 4 strand pcv pipes with foraging cups and colorful plastic discs bird toy for medium sized birds african grey amazon eclectus caiques cockatoos macaws,https://m.media-amazon.com/images/I/61NCOEzxbbL.jpg,pet bird supplies
73473,resident evil 7 biohazard greatest hits playstation 4,https://m.media-amazon.com/images/I/71MooWiK+uL.jpg,playstation 4 games consoles accessories
71241,nier replicant ver122474487139 ps4,https://m.media-amazon.com/images/I/81A0n7W+q2L.jpg,playstation 4 games consoles accessories
74819,skin ps4 pro camouflage snow limited edition decal cover adesiva playstation 4 slim sony bundle,https://m.media-amazon.com/images/I/51navitLG+L.jpg,playstation 4 games consoles accessories
70849,2pcs jds055 replacement charging port assembly for ps4 dualshock 4 repair part micro usb adaptor charger socket board connector module for playstation ds4 controller flex cable tool screwdriver,https://m.media-amazon.com/images/I/61Z-18YGpUL.jpg,playstation 4 games consoles accessories
69935,snowrunner playstation 4,https://m.media-amazon.com/images/I/81kXUwQom0L.jpg,playstation 4 games consoles accessories
74214,car mechanic simulator ps4 playstation 4,https://m.media-amazon.com/images/I/814ptbscPNL.jpg,playstation 4 games consoles accessories
75027,ralan fruit controller skins for ps4silicone controller cover skin protector compatible ps4 slimps4 pro controller with 8 cute thumb grips caps,https://m.media-amazon.com/images/I/61MOo1XrhkL.jpg,playstation 4 games consoles accessories
1228037,lume whole body deodorant invisible cream stick 72 hour odor control aluminum free baking soda free skin safe 22 ounce pack of 2 clean tangerine,https://m.media-amazon.com/images/I/71TG1JPxXLL.jpg,personal care products
1228518,ouai scalp body scrub deepcleansing scrub for hair skin removes buildup exfoliates moisturizes with sugar coconut oil free of parabens sulfates phthalates 88 fl oz,https://m.media-amazon.com/images/I/51FRNduDESL.jpg,personal care products
1228311,dial antibacterial deodorant gold bar soap 4 ounce pack of 20 net wt 5lbs,https://m.media-amazon.com/images/I/71D19Se2JQL.jpg,personal care products
1228416,the ordinary face serum set 100 plantderived squalane prevent ongoing loss of hydration niacinamide 10 zinc 1 reduces skin blemishes hyaluronic acid 2 b5 enhanced hydration,https://m.media-amazon.com/images/I/51bAc+VPJDL.jpg,personal care products
1229077,circulation foot soak 2 lbs epsom salt with natural ginger cypress eucalyptus and lavender essential oils plus vitamin c in bpa free pouch with easy presslock seal,https://m.media-amazon.com/images/I/81SKQV87WOL.jpg,personal care products
1228859,hey humans natural deodorant cedarwood sage 2oz pack of 2,https://m.media-amazon.com/images/I/51VN8wKTo3L.jpg,personal care products
1228295,antishrink korean asian exfoliating bath washcloths mitt scrub for body washcloth glove premium viscose rayon towel 6pack,https://m.media-amazon.com/images/I/81M3hiv1nhL.jpg,personal care products
1174666,planet puzzle league nintendo ds,https://m.media-amazon.com/images/I/71POb+lUr1L.jpg,nintendo ds games consoles accessories
1173627,i spy universei spy fun house game pack nintendo ds,https://m.media-amazon.com/images/I/8145H-BpRXL.jpg,nintendo ds games consoles accessories
1175036,star wars the clone wars jedi alliance nintendo ds renewed,https://m.media-amazon.com/images/I/51+y8PtfzmL.jpg,nintendo ds games consoles accessories
1173371,adventure box downtown santa monica los angeles multiplayer mystery escape room hunt adult and family interactive puzzle game for your city,https://m.media-amazon.com/images/I/71L4Y6eoOWL.jpg,nintendo ds games consoles accessories
1175171,kung fu panda legendary warriors nintendo ds,https://m.media-amazon.com/images/I/51cyt5IlnCL.jpg,nintendo ds games consoles accessories
1173478,pokemon soul silver japan import,https://m.media-amazon.com/images/I/917ewchZrjL.jpg,nintendo ds games consoles accessories
1174338,western riding academy nintendo ds,https://m.media-amazon.com/images/I/71zNuruWE1L.jpg,nintendo ds games consoles accessories
1042647,tim holtz advantus mummy cloth ideao 6yds multi,https://m.media-amazon.com/images/I/811OGING5IL.jpg,craft hobby fabric
1047230,solid plain velboa faux fur short pile fabric fuchsia 60 w sold bty faux fur,https://m.media-amazon.com/images/I/514SOvpP-pL.jpg,craft hobby fabric
1044706,magenta tulle fabric 40 yards per bolt,https://m.media-amazon.com/images/I/514kZGeVKOL.jpg,craft hobby fabric
1046916,holiday holly cotton fabric by the yard,https://m.media-amazon.com/images/I/61e3uvnU5nL.jpg,craft hobby fabric
1042270,5 pcs 197 x 157 inch fat quarters fabric bundles ethnic style precut quilting cloth colored printing cotton squares sheets for diy sewing patchwork face protectors crafting projects,https://m.media-amazon.com/images/I/71TPiMMaKQL.jpg,craft hobby fabric
1045969,fabric by the yard 58 inches x 1 yard decorative fabric for sewing quilting apparel crafts home decor accents sports equipment fitness gym barbells pattern,https://m.media-amazon.com/images/I/81F90Avyp-L.jpg,craft hobby fabric
1362928,new creations fabric foam inc 5354 wide gator fake leather upholstery 3d crocodile skin texture faux leather pvc vinyl fabric royal blue 1 yard,https://m.media-amazon.com/images/I/A1CdawwNetL.jpg,craft hobby fabric
1061940,nayrmaer clear wood glue professional furniture repair glue waterproof glue for wood crafts and furniture 150g51oz,https://m.media-amazon.com/images/I/714g84hTZoL.jpg,industrial adhesives sealants lubricants
1062778,gorilla micro precise super glue 6 gram clear pack of 6,https://m.media-amazon.com/images/I/81Rv262uvBL.jpg,industrial adhesives sealants lubricants
1070290,mg chemicals 8617a3ml silicone free premium thermal paste 810 g 1part syringe,https://m.media-amazon.com/images/I/61OFNIWTotL.jpg,industrial adhesives sealants lubricants
1067331,3m 012555425 translucent uhmw polyethylene tape 30 to 225 degrees f performance temperature 0005 thick,https://m.media-amazon.com/images/I/31-hS1oYAbL.jpg,industrial adhesives sealants lubricants
1065714,bxt 3 rolls painters tape 142 yards white masking paper for painting labeling crafts arts no residue easy tear and removable19 inch 14 inch095 inch,https://m.media-amazon.com/images/I/61kGLlVfnWL.jpg,industrial adhesives sealants lubricants
1067484,black electrical tape professional waterproof tape insulation tape for indoor and outdoor winding wire harnesses automotive electrical protection5 rolls 071 in wide 656 ft long 4mil thick,https://m.media-amazon.com/images/I/513b0hQTdyL.jpg,industrial adhesives sealants lubricants
1069568,3m 3454955 vhb acrylic foam tape 075 wide 5 yd length white,https://m.media-amazon.com/images/I/515bkd+vBeL.jpg,industrial adhesives sealants lubricants
1140179,handheld steamer for clothes mini travel clothes steamer with lcd screen 90 rotation portable garment steamer for home powerful clothing iron both wet steam and dry iron,https://m.media-amazon.com/images/I/51HIUo6YgGL.jpg,ironing products
1140101,the quilted bear mini iron lightweight mini steam iron with ceramic sole base plate temperature gauge for use as a craft iron or travel iron steamer black case,https://m.media-amazon.com/images/I/61QpuBBVGnL.jpg,ironing products
1140530,akoak 4 pack 2 different size high temperature ironing cloth ironing pad household protective insulation against pressing pad boards mesh clothrandom color,https://m.media-amazon.com/images/I/512AFTz4djL.jpg,ironing products
1140447,protective ironing scorch mesh cloth scorchsaving ironing protector pressing cloth pad for easy ironing and protection 4 pieces,https://m.media-amazon.com/images/I/81JrStLj7+S.jpg,ironing products
1140274,earlex ss77ussg steam generator 13gallon capacity 12 hose steamer for wood bending steam box for wood portable steam generator steam wood bender,https://m.media-amazon.com/images/I/71-MAZhnhkL.jpg,ironing products
1140739,juvale ironing board cover and pad standard size heavy duty gray stripe pattern 15 x 54 in,https://m.media-amazon.com/images/I/71XBrwOxUPL.jpg,ironing products
1140854,ironing board cover and pad 15x54 standard size ironing board cover with elastic edge for snug and secure fit thick and durable material yellow and green lemon print design,https://m.media-amazon.com/images/I/71Lssyd21PL.jpg,ironing products
262055,gellen gel nail polish set nude gray gel polish set neutral pink 6 colors soak off uv gel nail polish home salon gel manicure kit,https://m.media-amazon.com/images/I/51ERJe+V3bL.jpg,foot hand nail care products
257476,louinstic nail polish remover gel polish remover for nails in 35 minutes with latex tape for nails gel nail remover no need for foils easily quickly nail polish gel remover removedor de gel,https://m.media-amazon.com/images/I/71TmvuN0usL.jpg,foot hand nail care products
259876,144 slots wisteria flower nail art sticker storage book nail art decals collecting album empty display book collecting holder binder book plastic diy design tools for nail art sticker,https://m.media-amazon.com/images/I/61XCruA3+kL.jpg,foot hand nail care products
259801,gena pedi soak foot bath 85 oz,https://m.media-amazon.com/images/I/61QHdOUw+CL.jpg,foot hand nail care products
256953,tea tree oil foot soak with epsom salt made in usa for toenail irritations athletes foot stubborn foot odor scent softens calluses soothes sore tired feet 2 pack,https://m.media-amazon.com/images/I/71x2sIXBkTL.jpg,foot hand nail care products
256699,mr pumice ultimate pumi bar 2in1 callus remover pedicure stone ped file scrubber for smooth feet and heels dualgrit medium coarse 1 count,https://m.media-amazon.com/images/I/91uvs2kelLL.jpg,foot hand nail care products
257798,cross nail charms for acrylic nails 100pcs 3d nail art mini chrome cross nail charm nail gems punk nails metal charms skull charms heart nail art gothic croc charms nail art supplies diy charms,https://m.media-amazon.com/images/I/71UW9VXmFAL.jpg,foot hand nail care products
993193,hicarer 168 pieces pompoms earrings fabric metallic colorful pompoms earrings charms diy fluffy ball for tassel earrings charm pendant keychain jewelry making 24 colors,https://m.media-amazon.com/images/I/81j+0OVPuqL.jpg,beading jewelry making
991342,quefe 4100pcs 24 colors clay beads for bracelet making kit charm bracelet making kit for girls 812 polymer heishi beads for crafts,https://m.media-amazon.com/images/I/81jpepn-kJL.jpg,beading jewelry making
993396,natural black tourmaline gemstone round beads 155 a grad 8mm,https://m.media-amazon.com/images/I/61wxnEPDRuL.jpg,beading jewelry making
882930,silicone beads 150pcs bulk round large beads 15mm hexagon 14mm for jewelry making with lanyard key chain ring for keychain making macaron,https://m.media-amazon.com/images/I/71UF7LvH-KL.jpg,beading jewelry making
309754,20pcs mixed antiqued bronze charms clock face charm pendant diy crafts gears jewelry making steampunk pendants,https://m.media-amazon.com/images/I/71hUt0APJiL.jpg,beading jewelry making
883134,1200pcs 4 sizes abs pearl beads ivory no holes elegant luster pearls for crafts diy vase filling wedding birthday party home decoration 4mm 6mm 8mm10mm,https://m.media-amazon.com/images/I/61Wg0X4oNaL.jpg,beading jewelry making
882325,jialeey spiral bead cages pendants 30 pcs 3 sizes silver plated stone holder necklace cage pendants findings for jewelry making and crafting,https://m.media-amazon.com/images/I/81qcYrv7rkL.jpg,beading jewelry making
1274609,new titanic balloon cat collection plush figures cartoon pet stuffed cat toyscute cat plush for children birthday gifts and fans to collect c,https://m.media-amazon.com/images/I/61Mp01wEjDL.jpg,stuffed animals plush toys
1273240,aoriher 15 pcs halloween stuffed toys mini halloween plush toys small devil ghost plush keychain stuffed toy for halloween christmas birthday party favors goodie bag fillers ghost,https://m.media-amazon.com/images/I/61XaoCCWaYL.jpg,stuffed animals plush toys
1276745,cute black cat plush pillow throw pillow removable stuffed animal plush toy bag of soft gray cat plushies kawaii kitten plush doll sofa decorative pillow gifts for boys girls kids pink,https://m.media-amazon.com/images/I/71EqcxiPmgL.jpg,stuffed animals plush toys
1271811,five nights at freddys plushiesfive nights at freddys plushfnaf plushiesgift for fnaf plush game fans c04,https://m.media-amazon.com/images/I/61FzZgEZbOL.jpg,stuffed animals plush toys
1276213,anime plush toys821cm cute soft stuffed plushie toys home decor best gift,https://m.media-amazon.com/images/I/61lYTse9HlS.jpg,stuffed animals plush toys
