id,Title,Image,Category
1273790,bad cute bunny plush figure toy 94 inch love hearth plush toys for kids and fans gift for special valentinas christmas dayhearth man,https://m.media-amazon.com/images/I/41q7Q-QT82L.jpg,stuffed animals plush toys
1274203,squirrel warmies cozy plush heatable lavender scented stuffed animal,https://m.media-amazon.com/images/I/61sD56cDvAL.jpg,stuffed animals plush toys
1025962,37 pcs breast cancer awareness party decorations backdrop banner balloons pink ribbon outdoor yard sign hanging banner for breast cancer awareness scene banner breast cancer charity party supplies,https://m.media-amazon.com/images/I/81yN4i8kuVL.jpg,party supplies
1023788,papyrus birthday card very best in life,https://m.media-amazon.com/images/I/A1EBYHUcyFL.jpg,party supplies
1026086,8bit pixel miner cake topper for kids happy birthday party event mining video game craft decoration,https://m.media-amazon.com/images/I/61-oJVvlEeL.jpg,party supplies
1142470,80 packs halloween blood iv bag reusable energy drink container juice pouch prop for halloween zombie nurse hospital theme party decoration vampire party props 80pcs baglabel 6 syringes,https://m.media-amazon.com/images/I/91quI1JijXL.jpg,party supplies
1024317,4 number balloon 40 inch rainbow gradient with detachable crown easy inflate and deflate reusable premium foil mylar balloons for birthdays anniversaries and party decorations,https://m.media-amazon.com/images/I/51onOWAKTNL.jpg,party supplies
1026632,1st baby birthday photo banner from newborn to 12 months monthly milestone photograph rustic burlap bunting garland for baby first birthday baby shower decoration,https://m.media-amazon.com/images/I/61CLskdVFKL.jpg,party supplies
1024819,better office products 100pack all occasion greeting cards assorted blank note cards 4 x 6 inch 6 cute fun mixed designs blank inside with envelopes 100 pack,https://m.media-amazon.com/images/I/71pUaFQlCQL.jpg,party supplies
457211,baby girls champion unisex 3pk 5pk short sleeve or long sleeve infant body suit in multiple colors si and toddler t shirt set blue 06 us,https://m.media-amazon.com/images/I/61PBcRjD5OL.jpg,baby girls clothing shoes
458401,baby girl ruffled eyelet dress bloomer 2 piece set,https://m.media-amazon.com/images/I/61lGbM7BbVL.jpg,baby girls clothing shoes
456501,6m4y 3pcs baby girl casual hoodie jacket cotton tshirt pants sweater,https://m.media-amazon.com/images/I/51+sH7ICGBL.jpg,baby girls clothing shoes
459131,new born baby girl clothes infant girls long sleeve halloween ribbed romper bodysuit cartoon pumpkin prints bell,https://m.media-amazon.com/images/I/713+nxsZgXL.jpg,baby girls clothing shoes
457465,srt baby and toddler boys elliot leather sneaker,https://m.media-amazon.com/images/I/81MDK2wlT1L.jpg,baby girls clothing shoes
456795,infant baby fringe moccasin slipper boys girls tassel suede leather toddler sneakers soft sole first walking loafers crib shoes,https://m.media-amazon.com/images/I/61PJWKnVi2L.jpg,baby girls clothing shoes
459489,baby shoes toddler soft elastic casual first shoes solid indoor walkers infant baby baby shoes baby toddler girl,https://m.media-amazon.com/images/I/61IGI5pCI5S.jpg,baby girls clothing shoes
919162,hilitand replacement lcd display screen for psp 3000 3001 3002 3003 3004 3008 3010 console,https://m.media-amazon.com/images/I/511wjCj3cGL.jpg,sony psp games consoles accessories
918934,need for speed undercover sony psp,https://m.media-amazon.com/images/I/41kbDPsuv-L.jpg,sony psp games consoles accessories
919507,jikkyou powerful pro yakyuu 11 japan import,https://m.media-amazon.com/images/I/91a4pATAFsL.jpg,sony psp games consoles accessories
918871,spongebobs truth or square sony psp,https://m.media-amazon.com/images/I/716Ps3gk4SS.jpg,sony psp games consoles accessories
919120,major league baseball 2k7 sony psp,https://m.media-amazon.com/images/I/61XLaIUgjNL.jpg,sony psp games consoles accessories
919411,tiger bunny aired jack japan import,https://m.media-amazon.com/images/I/91oUd35vbaL.jpg,sony psp games consoles accessories
919034,monster hunter portable japan import,https://m.media-amazon.com/images/I/5170BQXV19L.jpg,sony psp games consoles accessories
1055447,yonput 1 pack car baby rearview mirror 2 in 1 auto baby observation mirror 35in x 23in wide angle convex 360 degrees adjustable suction cup auxiliary mirror universal aafety accessories black,https://m.media-amazon.com/images/I/71xJQL+HjiL.jpg,child safety car seats accessories
1053943,black and white cow skin baby car seat canopy cover multi use nursing cover for newborn car seat canopy mom nursing breastfeeding covers newborn shower gift,https://m.media-amazon.com/images/I/61esCu84ovL.jpg,child safety car seats accessories
1054338,musical car seat toys for babies 06 months babys activity center carseat toys sensory soft car seat hanging toy baby mirror for baby infant 0612 months sensory gift 3 6 12 months baby boys girls,https://m.media-amazon.com/images/I/71G8OY0gT9L.jpg,child safety car seats accessories
1055805,bpafree buckle booster seat belt receptacle stabilizer raises your buckle for easy reach no more fishingbruised hands stand buckle upright fasten seatbelt easily 1pack,https://m.media-amazon.com/images/I/7179ZC5xkUL.jpg,child safety car seats accessories
1053990,antilrti cute seat belt cover for kids kitty plush soft safety belt shoulder pads cartoon cat car seat shoulder strap harness pads for girl boy,https://m.media-amazon.com/images/I/71CuYKjYmsL.jpg,child safety car seats accessories
1055144,safety 1st baby on board front or back babyview mirror,https://m.media-amazon.com/images/I/719O0ew2lnL.jpg,child safety car seats accessories
1053564,arana 2 pack car kick mats for kids back seat protector kick mat cover waterproof sag proof with 3 storage pockets keep seat back clean and neat,https://m.media-amazon.com/images/I/71nByilpHeL.jpg,child safety car seats accessories
740941,razer goliathus extended chroma gaming mouse pad customizable chroma rgb lighting soft cloth material balanced control speed nonslip rubber base mercury white,https://m.media-amazon.com/images/I/616DwGLd39L.jpg,smart home home entertainment
740912,denon avrs960h 8k ultra hd 72 channel 90watt x 7 av receiver 2020 model built for gaming music streaming 3d audio video alexa heos black discontinued by manufacturer,https://m.media-amazon.com/images/I/71h1vpnQg9L.jpg,smart home home entertainment
740885,panasonic streaming 4k blu ray player ultra hd premium video playback with hires audio voice assist dpub420k black,https://m.media-amazon.com/images/I/51gImdCqtKL.jpg,smart home home entertainment
740947,denon avrx2700h 8k ultra hd 72 channel 95 watt x 7 av receiver 2020 model built for gaming music streaming 3d audio video alexa heos discontinued by manufacturer,https://m.media-amazon.com/images/I/61Jk4L3QJeL.jpg,smart home home entertainment
740859,logitech harmony hub discontinued by manufacturer,https://m.media-amazon.com/images/I/61VpLBCp2cL.jpg,smart home home entertainment
740896,sonos outdoor speakers pair of architectural speakers by sonance for outdoor listening wired,https://m.media-amazon.com/images/I/91fXbqVwFuL.jpg,smart home home entertainment
740849,sonos play 5 ultimate wireless smart speaker black,https://m.media-amazon.com/images/I/714WwwYk0NL.jpg,smart home home entertainment
1059403,aceworkz 100 pure saffron extract appetite suppressant for weight loss metabolism booster diet pills for women men 90 capsules,https://m.media-amazon.com/images/I/51o5XbGcSML.jpg,diet sports nutrition
1061323,source naturals huperzine a for learning memory 200 mcg 120 tablets,https://m.media-amazon.com/images/I/619d6DmmaRL.jpg,diet sports nutrition
1060669,gaia herbs microbiome cleanse with black walnut sweet wormwood oregano peppermint helps balance the gi tract while supporting digestive health 60 vegan liquid phytocapsules 30day supply,https://m.media-amazon.com/images/I/81l-Dt79QgS.jpg,diet sports nutrition
1061474,ketoscan smart breath ketone meter diet fitness tracker monitor your fat metabolism level of ketosis on low carb ketogenic or any nutrition fitness program,https://m.media-amazon.com/images/I/71YBbPohDML.jpg,diet sports nutrition
1059921,fenitra weight management formula helps to promote natural energy levels to boost metabolism 60 oval tablets for energy wellness,https://m.media-amazon.com/images/I/41kN2m71WtL.jpg,diet sports nutrition
1060365,source naturals guarana energizer 900 mg caffiene and energy 100 tablets,https://m.media-amazon.com/images/I/61jtLNfa35L.jpg,diet sports nutrition
1061371,honey stinger organic energy gels variety pack with sticker 12 count 4 of each flavor energy source for any activity acai pomegranate gold fruit smoothie,https://m.media-amazon.com/images/I/81dXESUhDRL.jpg,diet sports nutrition
1015450,cosmos pack of 4 transparent plastic portable travel toothbrush case holder organizer with hook for travel use,https://m.media-amazon.com/images/I/71ri9t4po5L.jpg,beauty personal care
1014792,electric toothbrush with water flosser cordless water flosser and toothbrush combo with 9 brush heads 5 tips 320ml ipx7 waterproof teeth cleaner for home travel use black,https://m.media-amazon.com/images/I/71n9neHIslL.jpg,beauty personal care
1014162,aquafresh cavity protection fluoride toothpaste cool mint 3 oz pack of 2,https://m.media-amazon.com/images/I/71LU2bKW07L.jpg,beauty personal care
1014816,teeth whitening kit ualans teeth whitener with 32x led blue red light 35 carbamide peroxide teeth whitening pen soothing gel enamel safe ipx6 waterproof professional 10 mins tooth whitening,https://m.media-amazon.com/images/I/61CuA0SP3sL.jpg,beauty personal care
1015228,organic neem 5 in 1 fluoride free toothpaste bundle with bamboo toothbrush neem clove black seed mint pure herbal teeth whitening blend for sensitive teeth,https://m.media-amazon.com/images/I/716mIKNJGNL.jpg,beauty personal care
1014632,pursonic s430 high power rechargeable electric sonic toothbrush with 12 brush heads storage charger blue,https://m.media-amazon.com/images/I/719aFtiPzDL.jpg,beauty personal care
1014279,5d white teeth whitening strips 14 treatment for teeth whitening 28 pcs professional teeth whitening strips whiten strips for teeth stains reduce mint flavor,https://m.media-amazon.com/images/I/81uV8NduGyL.jpg,beauty personal care
1169420,moen fp62327pf mpact positemp pressure balancing valve with 12 cold expansion pex connection,https://m.media-amazon.com/images/I/81XeBUcFfYL.jpg,pumps plumbing equipment
1166202,rectorseal 96100 ag 1100 switch tan,https://m.media-amazon.com/images/I/51JXUzdBleL.jpg,pumps plumbing equipment
1165874,fluidmaster 599 refill tube and clamp replacement black,https://m.media-amazon.com/images/I/51yHFoDWvuL.jpg,pumps plumbing equipment
1167407,prier c134kt803 stem packing replacement kit for c134135144154,https://m.media-amazon.com/images/I/51xohSzw9zL.jpg,pumps plumbing equipment
1171069,holdrite 34 inch acoustic standard clamp 5 pack pipe support pex copper cpvc 267z5,https://m.media-amazon.com/images/I/61J0lQj6+yL.jpg,pumps plumbing equipment
1166009,88624000 pullout hose combo for hansgrohe kitchen faucets pulldown spray hose replacement with brass connectors 59inch 105inch,https://m.media-amazon.com/images/I/71C+H8pHgmS.jpg,pumps plumbing equipment
1166887,king innovation 48024 king siphon pump 24 inch red,https://m.media-amazon.com/images/I/61++naVmLYL.jpg,pumps plumbing equipment
697713,gambler regular king size cigarette tubes 200 count pack of 5,https://m.media-amazon.com/images/I/61eYBS5PfFL.jpg,household supplies
697025,raytrade wool dryer balls 6pack 100 made of organic new zealand wool reduces clothing wrinkles and saves drying time reusable natural fabric softener stocking stuffer gifts,https://m.media-amazon.com/images/I/71NDmGQ3tDL.jpg,household supplies
697519,2 gallon zipper bags reclosable storage and freezer bags premium two gallon zip bags press and double lock heavy duty clear freezer bags for tight seal and fresh storage pack of 100,https://m.media-amazon.com/images/I/61HqvVBjBuL.jpg,household supplies
697365,aozita 210 pack 3 oz paper cups sky blue mouthwash cups disposable bathroom cups espresso cups paper cups for party picnic bbq travel and event,https://m.media-amazon.com/images/I/615yGL8fRzL.jpg,household supplies
697169,frost king cb3250 boxed heavy duty contractor clean 32 x 50 x 3 mil 32x50x3 inch pack of 20 20 bags black,https://m.media-amazon.com/images/I/71bb-XYuwfL.jpg,household supplies
696029,gain dryer sheets laundry fabric softener moonlight breeze 240 count,https://m.media-amazon.com/images/I/71kTSfAxVBL.jpg,household supplies
697423,aa rechargeable batteries 4 pack lithium ion high output fast long lasting usbc charge use wremote control battery operated toys keyboards wireless mice charger cable included,https://m.media-amazon.com/images/I/71-nYcVnMuL.jpg,household supplies
965395,moukeren 3 pcs boho nursery decor for girl daisy flower pom pom wall hanging bohemian nursery home wall decor nursery wall decor flowers for baby kids nursery dorm decor,https://m.media-amazon.com/images/I/71rVyfLJ4xL.jpg,nursery furniture bedding dcor
962959,mobile connector replacement toy pole conversion attachment for 4moms mamaroos model 1037 toy stand plastic,https://m.media-amazon.com/images/I/61orU6eJ7vL.jpg,nursery furniture bedding dcor
961172,baby playpen 50x50inch large play pen for babies and toddlers baby fence play yard safety kids playpin indooroutdoor,https://m.media-amazon.com/images/I/81VeJI3HLdL.jpg,nursery furniture bedding dcor
963545,baby monthly milestone blanket dinosaur soft flannel nursery bed blankets for boys photography background blankets,https://m.media-amazon.com/images/I/81xRrE88yTL.jpg,nursery furniture bedding dcor
962259,inspirational wall decor black motivational wall art inspirational quote wall stickers vinyl positive wall decal for living room bedroom office nursery restaurants offices 2 sheets,https://m.media-amazon.com/images/I/71eiGessoZL.jpg,nursery furniture bedding dcor
965311,baby girl wall decals purple flower butterfly wall sticker moon cloud wall decal colorful butterflies wall stickers princess room decor for girls nursery bedroom playroom,https://m.media-amazon.com/images/I/71yS87WzEDL.jpg,nursery furniture bedding dcor
967262,decowall da1406 animal train and hot air balloons kids wall stickers wall decals peel and stick removable wall stickers for kids nursery bedroom living room dcor,https://m.media-amazon.com/images/I/71U8rWB56xL.jpg,nursery furniture bedding dcor
143290,amazon basics 60 watt equivalent red nondimmable a19 led light bulb 2pack,https://m.media-amazon.com/images/I/7146y3VIc5L.jpg,light bulbs
146750,aielit dimmable 2 watt globe led light bulbs 25w equivalent warm white 2700k a15a50 led bulb e26 medium base antique filament edison decorative bulb for chandelier ceiling fan 4 pcs,https://m.media-amazon.com/images/I/710w01kmnuL.jpg,light bulbs
145594,vstar g9 50w halogen bulb 120volt base g9 halogen bulb10 pack,https://m.media-amazon.com/images/I/61C8kZgx3CL.jpg,light bulbs
145955,westinghouse 7015800 light fixture lock up caps,https://m.media-amazon.com/images/I/51B0DUqnuRL.jpg,light bulbs
150389,philips 230326 energy saver compact fluorescent nonintegrated 9watt pls soft white 2pin base light bulb,https://m.media-amazon.com/images/I/61cy3a0fUWL.jpg,light bulbs
150247,light maker e14 led bulb 15w refrigerator light bulb 120v daylight white,https://m.media-amazon.com/images/I/619RZly0UGL.jpg,light bulbs
143788,scentsy bulb10 pack wax warmer light bulbs 15wreplacement bulbs for himalayan salt lamps baskets chandeliers scentsy wax warmers night lights 15we12 bulbs,https://m.media-amazon.com/images/I/71SvK25WeZL.jpg,light bulbs
